{
  "84692511-7054-440c-92cc-b28eadc8c588": "# Синтетические данные для проверки графа знаний\n\n## Раздел 1: Основные концепции\n\nИскусственный интеллект (ИИ) представляет собой технологию, способную имитировать когнитивные функции человека. Он включает различные подходы: машинное обучение, глубокое обучение, нейронные сети и символьные системы. Машинное обучение опирается на статистические методы и большие объемы данных для поиска закономерностей.\n\nГлубокое обучение, особая разновидность машинного обучения, использует многослойные нейронные сети для обработки сложных данных. Такие сети могут состоять из миллионов параметров, настраиваемых в процессе обучения. Обучение глубоких нейронных сетей требует значительных вычислительных ресурсов, обычно в виде графических процессоров (GPU) или специализированных ускорителей, таких как TPU.\n\nТрансформеры представляют собой современную архитектуру нейронных сетей, основанную на механизме внимания. Они произвели революцию в обработке естественного языка (NLP), позволив моделям более эффективно обрабатывать долговременные зависимости в тексте. Модель BERT, разработанная Google, и GPT, созданная OpenAI, являются яркими примерами трансформеров.\n\n## Раздел 2: Практическое применение\n\nСовременные системы ИИ находят применение во многих сферах. В медицине алгоритмы машинного обучения помогают диагностировать заболевания, анализируя медицинские изображения. Профессор Медицинского центра Стэнфордского университета Эндрю Нг разработал алгоритм, способный диагностировать пневмонию по рентгеновским снимкам грудной клетки с точностью, превышающей результаты опытных рентгенологов.\n\nВ финансовом секторе ИИ используется для обнаружения мошенничества и автоматизации торговли. Компания \"Альфа Финанс\" внедрила систему детектирования мошеннических транзакций, снизив количество ложных срабатываний на 35% и увеличив точность обнаружения реальных случаев мошенничества на 28%.\n\nВ транспортной отрасли беспилотные автомобили используют компьютерное зрение и машинное обучение для восприятия окружающей среды и принятия решений в реальном времени. Компания \"Автономтех\" проводит испытания самоуправляемых автомобилей на городских улицах, где их системы должны обрабатывать сложные сценарии движения и взаимодействовать с другими участниками дорожного движения.\n\n## Раздел 3: Этические аспекты и проблемы\n\nРазвитие ИИ сопряжено с рядом этических проблем. Алгоритмическая предвзятость может привести к дискриминации определенных групп людей. Исследование, проведенное доктором Хлоей Хайнс из Центра Этичного ИИ, выявило, что системы распознавания лиц часто демонстрируют более низкую точность при идентификации женщин и людей с темной кожей.\n\nВопросы конфиденциальности и защиты данных также вызывают озабоченность, поскольку ИИ-системы часто требуют доступа к личным данным. Европейская комиссия предложила новые правила, требующие от компаний получения явного согласия пользователей перед использованием их данных для обучения ИИ-моделей.\n\nАвтоматизация, связанная с внедрением ИИ, может привести к исчезновению рабочих мест. По данным исследования Института Будущего Труда, к 2030 году до 20% рабочих мест могут быть автоматизированы с помощью ИИ-технологий. Однако это же исследование предполагает создание новых профессий, связанных с разработкой, обслуживанием и надзором за ИИ-системами.\n\n## Раздел 4: Будущие направления\n\nКвантовые вычисления представляют собой новый подход к обработке информации, использующий принципы квантовой механики. Квантовые компьютеры могут значительно ускорить решение определенных задач, таких как оптимизация и моделирование сложных систем. Компания \"КвантумТех\" разрабатывает квантовый процессор с 128 кубитами, который, по заявлениям компании, сможет решать задачи, недоступные для традиционных суперкомпьютеров.\n\nНейроморфные вычисления стремятся воспроизвести структуру и функционирование человеческого мозга в вычислительных системах. Профессор Микеле Валентин из Нейротехнологического института работает над созданием чипа, имитирующего работу нейронов и синапсов, что позволит создавать более энергоэффективные и адаптивные ИИ-системы.\n\nИскусственный общий интеллект (AGI) – гипотетическая форма ИИ, способная выполнять любые интеллектуальные задачи, доступные человеку. Хотя создание AGI остается отдаленной целью, многие исследователи, включая доктора Яна Леонарда из Института Перспективных Исследований, активно работают над решением фундаментальных проблем, стоящих на пути к его созданию, таких как трансфер обучения и причинно-следственное моделирование.\n\n## Раздел 5: Интеграция технологий\n\nИнтернет вещей (IoT) и ИИ совместно создают \"умные\" экосистемы, где устройства обмениваются данными и принимают решения без вмешательства человека. Компания \"СмартХоум\" разработала систему управления домом, которая анализирует паттерны поведения жителей и автоматически регулирует освещение, температуру и безопасность, снижая энергопотребление на 23%.\n\nБлокчейн и ИИ могут дополнять друг друга: блокчейн обеспечивает прозрачность и доверие для данных, используемых ИИ-системами, а ИИ может оптимизировать функционирование блокчейн-сетей. Стартап \"БлокИнтеллект\" создает распределенную платформу для безопасного обмена моделями машинного обучения и данными между организациями.\n\nРасширенная и виртуальная реальность (AR/VR) в сочетании с ИИ открывают новые возможности для образования, развлечений и профессиональной подготовки. Образовательная платформа \"ВиртуЛерн\" использует ИИ для создания персонализированных учебных сценариев в виртуальной среде, адаптируя сложность и содержание к уровню знаний и стилю обучения каждого студента.\n\n## Заключение\n\nИскусственный интеллект продолжает развиваться, проникая во все аспекты нашей жизни. Междисциплинарное сотрудничество между специалистами по компьютерным наукам, когнитивной психологии, этике и другим областям необходимо для реализации потенциала ИИ при минимизации рисков. Ответственный подход к разработке и внедрению ИИ-технологий требует участия всего общества в обсуждении ключевых вопросов регулирования и определения направлений дальнейшего развития.",
  "1b182acf-90ce-457d-b4cc-f2cbfc3fefed": "# Синтетические данные для проверки графа знаний",
  "12582e39-506e-4edc-a305-72b980e2ebf4": "## Раздел 1: Основные концепции",
  "c19d4c48-c8fe-4aab-a171-b7f937f5b155": "Искусственный интеллект (ИИ) представляет собой технологию, способную имитировать когнитивные функции человека. Он включает различные подходы: машинное обучение, глубокое обучение, нейронные сети и символьные системы. Машинное обучение опирается на статистические методы и большие объемы данных для поиска закономерностей.",
  "759042ab-4414-40df-95e9-6998df5ca03a": "Глубокое обучение, особая разновидность машинного обучения, использует многослойные нейронные сети для обработки сложных данных. Такие сети могут состоять из миллионов параметров, настраиваемых в процессе обучения. Обучение глубоких нейронных сетей требует значительных вычислительных ресурсов, обычно в виде графических процессоров (GPU) или специализированных ускорителей, таких как TPU.",
  "6d7b36e7-64e7-42e5-8424-6d928475a27f": "Трансформеры представляют собой современную архитектуру нейронных сетей, основанную на механизме внимания. Они произвели революцию в обработке естественного языка (NLP), позволив моделям более эффективно обрабатывать долговременные зависимости в тексте. Модель BERT, разработанная Google, и GPT, созданная OpenAI, являются яркими примерами трансформеров.",
  "35128ecb-2747-4e61-a3e5-c9d152b071cc": "## Раздел 2: Практическое применение",
  "826cf327-5083-45e4-9971-75fb3ad4c05b": "Современные системы ИИ находят применение во многих сферах. В медицине алгоритмы машинного обучения помогают диагностировать заболевания, анализируя медицинские изображения. Профессор Медицинского центра Стэнфордского университета Эндрю Нг разработал алгоритм, способный диагностировать пневмонию по рентгеновским снимкам грудной клетки с точностью, превышающей результаты опытных рентгенологов.",
  "8ebffdb2-e155-4251-b361-83051cb3ad98": "В финансовом секторе ИИ используется для обнаружения мошенничества и автоматизации торговли. Компания \"Альфа Финанс\" внедрила систему детектирования мошеннических транзакций, снизив количество ложных срабатываний на 35% и увеличив точность обнаружения реальных случаев мошенничества на 28%.",
  "09880bdd-cfde-4ed3-b4a1-dc268a7c79e1": "В транспортной отрасли беспилотные автомобили используют компьютерное зрение и машинное обучение для восприятия окружающей среды и принятия решений в реальном времени. Компания \"Автономтех\" проводит испытания самоуправляемых автомобилей на городских улицах, где их системы должны обрабатывать сложные сценарии движения и взаимодействовать с другими участниками дорожного движения.",
  "3ae9851a-d6aa-44bd-90e1-e8133487d811": "## Раздел 3: Этические аспекты и проблемы",
  "ad4a94b5-6aa0-4e40-a668-40e857e0759e": "Развитие ИИ сопряжено с рядом этических проблем. Алгоритмическая предвзятость может привести к дискриминации определенных групп людей. Исследование, проведенное доктором Хлоей Хайнс из Центра Этичного ИИ, выявило, что системы распознавания лиц часто демонстрируют более низкую точность при идентификации женщин и людей с темной кожей.",
  "3cff3d15-bdc9-45b6-a654-58ba183d7812": "Вопросы конфиденциальности и защиты данных также вызывают озабоченность, поскольку ИИ-системы часто требуют доступа к личным данным. Европейская комиссия предложила новые правила, требующие от компаний получения явного согласия пользователей перед использованием их данных для обучения ИИ-моделей.",
  "2f87cb25-4fe3-4fe5-b883-c0ea1b3ea9b0": "Автоматизация, связанная с внедрением ИИ, может привести к исчезновению рабочих мест. По данным исследования Института Будущего Труда, к 2030 году до 20% рабочих мест могут быть автоматизированы с помощью ИИ-технологий. Однако это же исследование предполагает создание новых профессий, связанных с разработкой, обслуживанием и надзором за ИИ-системами.",
  "cea2b7cb-196a-4c12-baf2-66a940242518": "## Раздел 4: Будущие направления",
  "afc9f57d-a557-4748-8d7e-843c30c77c8a": "Квантовые вычисления представляют собой новый подход к обработке информации, использующий принципы квантовой механики. Квантовые компьютеры могут значительно ускорить решение определенных задач, таких как оптимизация и моделирование сложных систем. Компания \"КвантумТех\" разрабатывает квантовый процессор с 128 кубитами, который, по заявлениям компании, сможет решать задачи, недоступные для традиционных суперкомпьютеров.",
  "17aba6f4-4596-4efc-9a29-3d9203fd1fb4": "Нейроморфные вычисления стремятся воспроизвести структуру и функционирование человеческого мозга в вычислительных системах. Профессор Микеле Валентин из Нейротехнологического института работает над созданием чипа, имитирующего работу нейронов и синапсов, что позволит создавать более энергоэффективные и адаптивные ИИ-системы.",
  "0030ffe1-0613-4da9-ad3d-9ed983c2d262": "Искусственный общий интеллект (AGI) – гипотетическая форма ИИ, способная выполнять любые интеллектуальные задачи, доступные человеку. Хотя создание AGI остается отдаленной целью, многие исследователи, включая доктора Яна Леонарда из Института Перспективных Исследований, активно работают над решением фундаментальных проблем, стоящих на пути к его созданию, таких как трансфер обучения и причинно-следственное моделирование.",
  "ad7d2c64-11fc-4f85-aadf-5a84a33408eb": "## Раздел 5: Интеграция технологий",
  "97dc17ae-9ae5-4a69-8049-10b0ab35e2d7": "Интернет вещей (IoT) и ИИ совместно создают \"умные\" экосистемы, где устройства обмениваются данными и принимают решения без вмешательства человека. Компания \"СмартХоум\" разработала систему управления домом, которая анализирует паттерны поведения жителей и автоматически регулирует освещение, температуру и безопасность, снижая энергопотребление на 23%.",
  "97d3fcd1-1545-4f98-b4a1-1a5af83c4993": "Блокчейн и ИИ могут дополнять друг друга: блокчейн обеспечивает прозрачность и доверие для данных, используемых ИИ-системами, а ИИ может оптимизировать функционирование блокчейн-сетей. Стартап \"БлокИнтеллект\" создает распределенную платформу для безопасного обмена моделями машинного обучения и данными между организациями.",
  "905d5536-7aec-4fb3-9795-dbccf414c78e": "Расширенная и виртуальная реальность (AR/VR) в сочетании с ИИ открывают новые возможности для образования, развлечений и профессиональной подготовки. Образовательная платформа \"ВиртуЛерн\" использует ИИ для создания персонализированных учебных сценариев в виртуальной среде, адаптируя сложность и содержание к уровню знаний и стилю обучения каждого студента.",
  "04cadd9a-5a84-4da3-b821-bd88c6315ac2": "## Заключение",
  "ea30dde0-79bc-401a-bce7-1b252ad45155": "Искусственный интеллект продолжает развиваться, проникая во все аспекты нашей жизни. Междисциплинарное сотрудничество между специалистами по компьютерным наукам, когнитивной психологии, этике и другим областям необходимо для реализации потенциала ИИ при минимизации рисков. Ответственный подход к разработке и внедрению ИИ-технологий требует участия всего общества в обсуждении ключевых вопросов регулирования и определения направлений дальнейшего развития."
}